{"catalog_id":"valuation.policies.comparison_ranking","catalog_version":"1.0.0","effective_from":"2026-07-15","entries":[{"body":{"cadence":"canonical_monthly","direction":"higher_is_more_attractive","duplicate_precedence":"latest_cutoff_wins","eligible_statuses":["available"],"gate_table":[{"eligibility_state":"eligible","statistics_allowed":["raw_percentile","attractiveness_percentile"],"when":{"of":[{"comparator":">=","field":"eligible_count","op":"compare","threshold":"24"},{"comparator":">=","field":"calendar_span_months","op":"compare","threshold":"24"},{"comparator":">=","field":"distinct_financial_anchor_count","op":"compare","threshold":"4"}],"op":"all"}},{"eligibility_state":"provisional","statistics_allowed":["median","range"],"when":{"of":[{"comparator":">=","field":"eligible_count","op":"compare","threshold":"24"},{"comparator":">=","field":"calendar_span_months","op":"compare","threshold":"24"}],"op":"all"}},{"eligibility_state":"provisional","statistics_allowed":["median","range"],"when":{"comparator":">=","field":"eligible_count","op":"compare","threshold":"12"}},{"eligibility_state":"excluded_insufficient_data","statistics_allowed":[],"when":{"comparator":">=","field":"eligible_count","op":"compare","threshold":"0"}}],"method_family":null,"outlier_policy":"none","percentile_formula_ref":"val.formula.comparison.raw_percentile","policy_id":"val.policy.comparison.ranking.historical_self@1.0.0","policy_version":"1.0.0","quantile_method":"type_7","reason_code_order":["comparison.insufficient_history","comparison.history_span_below_minimum","comparison.financial_anchor_concentration","comparison.method_regime_mismatch","comparison.insufficient_peer_count","comparison.method_coverage_below_threshold","comparison.subject_in_peer_count","comparison.tier_mixing","comparison.rank_ineligible_value","comparison.outlier_quarantined","comparison.excluded_ranked_bottom","comparison.tie_break_changes_rank","comparison.rank_context_missing"],"subject_exclusion":false,"tie_policy":"midrank","variant":"historical_self"},"entry_id":"val.policy.comparison.ranking.historical_self","entry_version":"1.0.0","label":"T74 historical_self ranking policy","lifecycle_status":"approved","source_contract_refs":["docs/valuation-t66-08-comparison-specification.md","docs/valuation-t67-06-comparison-ranking-policy-catalog.md"]},{"body":{"cadence":null,"direction":"higher_is_more_attractive","duplicate_precedence":"not_applicable","eligible_statuses":["available"],"gate_table":[{"eligibility_state":"eligible","statistics_allowed":["raw_percentile","attractiveness_percentile","midrank","median","range","quartiles"],"when":{"of":[{"comparator":">=","field":"eligible_peer_count","op":"compare","threshold":"5"},{"comparator":">=","field":"coverage_ratio","op":"compare","threshold":"0.70"}],"op":"all"}},{"eligibility_state":"provisional","statistics_allowed":["median","range"],"when":{"comparator":">=","field":"eligible_peer_count","op":"compare","threshold":"3"}},{"eligibility_state":"excluded_insufficient_data","statistics_allowed":[],"when":{"comparator":">=","field":"eligible_peer_count","op":"compare","threshold":"0"}}],"method_family":null,"outlier_policy":"none","percentile_formula_ref":"val.formula.comparison.raw_percentile","policy_id":"val.policy.comparison.ranking.sector_peer@1.0.0","policy_version":"1.0.0","quantile_method":"type_7","reason_code_order":["comparison.insufficient_history","comparison.history_span_below_minimum","comparison.financial_anchor_concentration","comparison.method_regime_mismatch","comparison.insufficient_peer_count","comparison.method_coverage_below_threshold","comparison.subject_in_peer_count","comparison.tier_mixing","comparison.rank_ineligible_value","comparison.outlier_quarantined","comparison.excluded_ranked_bottom","comparison.tie_break_changes_rank","comparison.rank_context_missing"],"subject_exclusion":true,"tie_policy":"midrank","variant":"sector_peer"},"entry_id":"val.policy.comparison.ranking.sector_peer","entry_version":"1.0.0","label":"T74 sector_peer ranking policy","lifecycle_status":"approved","source_contract_refs":["docs/valuation-t66-08-comparison-specification.md","docs/valuation-t67-06-comparison-ranking-policy-catalog.md"]}],"lifecycle_status":"approved","schema_version":"1.0.0"}
