{"catalog_id":"valuation.policies.status_confidence_assessment","catalog_version":"1.0.0","effective_from":"2026-07-15","entries":[{"body":{"decision_type":"controlled_vocabulary","values":["high","medium","low","insufficient"]},"entry_id":"val.policy.status.confidence_level_vocab","entry_version":"1.0.0","label":"Confidence level vocabulary","lifecycle_status":"approved","source_contract_refs":["docs/valuation-t67-05-status-confidence-assessment-policy-catalog.md#2"]},{"body":{"decision_type":"policy_decision","policy_family":"confidence.propagation","rules":["A critical input at insufficient confidence forces the output to insufficient (canonical publication blocked).","A critical input at low confidence caps the output at low.","A critical input at minimum medium plus a material low elsewhere caps the output at medium.","A contextual-only (non-critical) low does not automatically downgrade the output, but creates an explicit disclosure.","Combined confidence is always a critical-min/cap policy, never an arithmetic mean."]},"entry_id":"val.policy.status.confidence_propagation","entry_version":"1.0.0","label":"Criticality-based confidence propagation","lifecycle_status":"approved","source_contract_refs":["docs/valuation-t67-05-status-confidence-assessment-policy-catalog.md#5"]},{"body":{"decision_type":"policy_decision","mapping":[{"current_use_state":"canonical_current","worst_required_freshness":"fresh"},{"current_use_state":"current_with_disclosure","worst_required_freshness":"acceptable"},{"current_use_state":"diagnostic_only","worst_required_freshness":"stale"},{"current_use_state":"blocked","worst_required_freshness":"expired"},{"current_use_state":"blocked","worst_required_freshness":"unknown"}],"policy_family":"current_use.capability"},"entry_id":"val.policy.status.current_use_capability_propagation","entry_version":"1.0.0","label":"Freshness to current-use capability propagation","lifecycle_status":"approved","source_contract_refs":["docs/valuation-t67-05-status-confidence-assessment-policy-catalog.md#3"]},{"body":{"decision_type":"controlled_vocabulary","values":["fresh","acceptable","stale","expired","unknown"]},"entry_id":"val.policy.status.freshness_state_vocab","entry_version":"1.0.0","label":"Freshness state vocabulary","lifecycle_status":"approved","source_contract_refs":["docs/valuation-t67-05-status-confidence-assessment-policy-catalog.md#2"]},{"body":{"decision_type":"policy_decision","ordered_precedence":[{"rank":1,"status":"calculation_blocked","trigger":"structural/version/identity conflict"},{"rank":2,"status":"not_applicable","trigger":"design/company mismatch"},{"rank":3,"status":"insufficient_data","trigger":"required contract coverage absent"},{"rank":4,"status":"unavailable","trigger":"single required observation absent"},{"rank":5,"status":"not_meaningful","trigger":"economic interpretation invalid"},{"rank":6,"status":"not_comparable","trigger":"comparison-only incompatibility"},{"rank":7,"status":"available","trigger":"all gates pass"}],"policy_family":"status.precedence"},"entry_id":"val.policy.status.method_status_precedence","entry_version":"1.0.0","label":"Method/field status precedence order","lifecycle_status":"approved","source_contract_refs":["docs/valuation-t67-01-catalog-meta-contract.md#10","docs/valuation-t67-05-status-confidence-assessment-policy-catalog.md#4"]}],"lifecycle_status":"approved","schema_version":"1.0.0"}
